name,comment,sentiment_type,polarity,subjectivity
Nate Showtimee,Came day my birthday truly never forget once a lifetime experience view greatest movie all time theaters It was like watching super bowl can still hear the cheers chills,Positive,0.6666666666666666,0.8333333333333333
Claire Trinidad,Tony saying Whatever takes hit much different,Neutral,0.0,0.6
Akshat,YouTube thought wud gud recommend rn,Positive,0.0,0.0
Spirit wolf Games,Currently watching MCU universe and cant help think many I gonna to watch I wanna marathon the movies phase four completely lol,Positive,0.43333333333333335,0.5333333333333333
visible,Awesome,Positive,1.0,1.0
,been 2 years,Neutral,0.0,0.0
Tryas -,AMAZING,Positive,0.6000000000000001,0.9
Melly4k,thanos fails wipe half humanity Covid fine Ill it,Negative,-0.1875,0.4916666666666667
Onelife gg,What ever takes goosebumps,Neutral,0.0,0.0
Jishnu Jishnu,ONE OF THE MOST MOVIE IN THE WORLD IAM FROM INDIA KERALA,Neutral,0.5,0.5
Rizki ramadhan Asy'ary,Best movie ever,Positive,1.0,0.3
xino951,God was a long time ago Once a life time,Positive,-0.05,0.4
joe swanson.,Bro was almost 3 years ago,Neutral,0.0,0.0
Extreme Linkiklie,The beginning am Iron Man The end am Iron Man,Neutral,0.0,0.0
Grandma Yooodel,Cant wait,Neutral,0.0,0.0
Rohith Mohan,remember discussing friend whether trailer came or the entire week attending my class finally one evening texted saying out boom,Positive,0.0,0.8125
PHEONIX MASTER,It recommended after 2 years,Positive,0.0,0.0
Al Helal Islam,Still goosebumps,Neutral,0.0,0.0
LIKER Gaming,Kon kon KGF chapter2 ka trailer dekhne ke bad Endgame ka trailer dekhne Aaya,Negative,-0.6999999999999998,0.6666666666666666
Vinayak Bhardwaj,You could live ending Where that bring Back the trailer,Neutral,0.06818181818181818,0.25
シHikaru._.Tykonシ,Even though been 2 a half years trailer still gives goosebumps,Neutral,-0.16666666666666666,0.16666666666666666
hanif,listening audio nostalgic missing the OG avengers,Negative,-0.35,0.525
Alana Wilkins,This movie my second favourite mcu movie,Neutral,0.0,0.0
Super,really miss experience watching Infinity War Endgame theaters Cant wait No Way Home drop DvD,Negative,0.2,0.2
AKHIL FF,need avengers 5,Neutral,0.0,0.0
YouTube Zone,The beginning am Iron Man The end am Iron Man,Neutral,0.0,0.0
Hail to the King,This what try tell DC fans thing a soul,Neutral,0.0,0.0
Iker Gorostidi Baptista,honestly wouldnt care this movie 6 hours long,Positive,0.27499999999999997,0.65
Rafael Velasquez,This movie know will hit the 1 billion dollar mark it goes back theaters their 50th Anniversary,Neutral,0.0,0.0
SAWYER GAMING,The master piece,Neutral,0.0,0.0
jeevana samskriti,Bring back tony,Neutral,0.0,0.0
Mohammed Ameen,is part humanitys history,Neutral,0.0,0.0
javith meeran,Still watching in 2022,Neutral,0.0,0.0
Ishan Pandey,cried Tony said WHATEVER IT TAKES want Iron Man Natasha back,Negative,0.0,0.0
Larry Mcphe,Its like wanted keep Tonys hippi haircut secret,Positive,-0.4,0.7
R҉Y҉4҉N҉5҉7҉6҉,Brings back good old days COVID the hype so crazy got the Ronin haircut Good times,Positive,0.18,0.4600000000000001
Bisa _hehe,No cuz this trailer came the world became better place,Positive,0.5,0.5
NewGod,cant believe been 2 years,Neutral,0.0,0.0
jaime lannister,It took Tony Stark,Neutral,-0.2,0.6
joscelyn mcgreer,Me realizing trailer shows red the black white parts like wandavision,Positive,-0.05555555555555555,0.14444444444444446
Khalisya Nadine,miss era sm,Negative,0.0,0.0
10k_enanoo,Still best movie has ever dropped forever be best movie ever drop,Positive,1.0,0.3
DEADPOOL wrestler,It cant 2 years We seen in theaters,Neutral,0.0,0.0
Prithvi Gupta,dont think therell this much HYPE a movie,Neutral,0.2,0.2
.,jan 28 2022 i know marvel fans want go back time to relive the first theatre experience endgame,Positive,0.125,0.16666666666666666
Rohan Kar,Man is I call to build hype Im speechless The Avengers Theme the dark emotional atmospheric feel made cry bad its inexpressible Whatever takes,Negative,-0.15999999999999998,0.4833333333333334
Parker Reynolds,2 years already Feels like yesterday,Positive,0.0,0.0
The Vagabond,Some people watch trailer without liking But us,Negative,0.0,0.0
Muh. Fadhil Anugrah Fasya,were beautiful days,Positive,0.85,1.0
sinister strange,We Dont want COVID vaccinewe need vaccine remove from headsso can rewatch in theatres have same hype,Negative,0.0,0.125
die345,Chidoee,Neutral,0.0,0.0
Spensta T,unfortunately victim spoilers never saw movie theaters not a big marvel fan time Then played LEGO Marvel games COVID Avengers game everyone forgotten by games really got into Then dad got disney right graduated high school 2021 one many things dying check was MCU I binged every movie release order even the ones I had already seen the past iron man 13 Avengers 12 Guardians Infinity War blew away despite knowing the end result Endgame It was as I never got spoiled the first place Now Im caught on MCU content except Eternals I hyped No Way Home I am so glad I finally witnessed phenomenon and I love 3000,Positive,0.13922619047619048,0.4590873015873016
BozeMøntana,Im a time heist To see movie the first time,Neutral,0.25,0.3333333333333333
Kj,dont think heart take if Thor doesnt get win,Negative,0.8,0.4
DOOMBLAZER,Everyone tomorrow NEED get official trailer SpiderMan No Way Home at LEAST 100 Million Views,Negative,-0.3,0.4
FireflyRevolution,really miss times we were excited the trailer waiting weeks months theorizing whats going happen guess we gonna get the trailer time man Avengers endgame such a fantastic movie,Positive,0.24375,0.5875
Siddharth Dogra,So sad yelenathe sibling bond so exciting better watch,Positive,0.09999999999999999,0.7666666666666666
Enzo Argentino,The fact they didnt show anything the movie just perfect,Positive,1.0,1.0
mr_sourabh77,,Neutral,0.0,0.0
Josh Guest,remember this trailer came We class people started talking Avengers fair enough verey popular series Then looked my phone saw notification this trailer The whole class basically exploded we al 20 people begged teacher let us watch trailer whiteboard Our teacher pulled up youtube And Ill never forget the pure collective joy an entire room young teenagers felt in that moment This movie something special well never see anything like again,Positive,0.24714285714285716,0.5996428571428571
Smiv,Wish could go back time feel endgame hype,Positive,0.0,0.0
eddie jaimes,este siempre sera el mejor trailer de la historia ver si el 2do trailer way home lo supera,Neutral,0.0,0.0
عبدالرحمن ترک,kgf break trailer record,Neutral,0.0,0.0
John Ambriz,The way SpiderMan way home even on same level this if bring back tobey Andrew,Neutral,0.0,0.0625
Rachel Binu,,Neutral,0.0,0.0
S Visuals,People back Laughing Natasha training a gun,Positive,0.0,0.0
Isaiah The Potato,God have 3 our favorite super heros dead to old the rest part time almost times well Im ready,Positive,0.18666666666666668,0.5533333333333333
Multiple Muffins,Yall better clapping the theater that Stan lee cameo shows,Positive,0.5,0.5
GabrielWars100,think Avengers Endgame truly onceinalifetime experience Id anything get hype feeling,Positive,0.0,0.0
Anagha Vempaty,regret being Marvel fan time watched entire MCU far my laptop But movie just different level Imagine watching this a theatre the crowd goes wild Can imagine awesome would been Edit Thanks the 254 likes Never got many in my life,Positive,0.2714285714285714,0.6178571428571429
MAGA Trump 2024,RIP IRON MAN,Neutral,0.0,0.0
BettyMacro The 97th,There never film had many theories was talked ever in history humanity What a privilege was experience Excitement this World wide event,Positive,0.2,0.45
Your Name,Most viewed trailer ever,Neutral,0.5,0.5
NoSpeaking YT,Some people think weird keep watching trailer everyday But us,Negative,-0.35,0.8
ItzzCastlz,still cant forget good movie,Negative,0.7,0.6000000000000001
sandesh kumar ny,Tonys whatever takes feels something else,Neutral,0.0,0.0
JESSY ANTONY,Iron man,Neutral,0.0,0.0
Wyatt R.,still get chills watching trailer Truly end an era remember wanted movie come so bad shouldve enjoyed more will never see hype like in life another movie,Neutral,0.10000000000000005,0.6222222222222222
Lybee _,Endgame wasnt end og Avengers also Marvel,Positive,0.0,0.0
Z. B. G.,Infinity war Thor Bring Me Thanos Endgame Thor Bring Me Beer,Negative,0.0,0.0
Chronological Gamerz,No one deny theme music on another level humankind not even discovered This theme music is the best,Positive,1.0,0.3
Sintro,kids experience whole different beginning end a new series like MCUbut whatever will bei think im glad lived this one,Positive,0.2090909090909091,0.6136363636363636
Youtubenautas,Can revive Iron Man the dragon spheres sorry mean the infinity gems,Positive,-0.40625,0.84375
cow 🐮,Every time watch trailer get chills tear bit The mcu come far since iron man first came Im proud be a part the fandom,Positive,0.3833333333333333,0.7777777777777777
Ashik vichu,Yeah recommended trailers marvel never gonna stop,Positive,0.0,0.0
Leugim,Final scene In loving memory Stan Lee,Positive,0.3,0.975
DARK-lXl•_•lXl-N3XUS,One the best movies the MCU whole Marvel universe,Positive,0.6,0.35
Karbon,This could all avoided Gamora just went right Smh,Negative,0.2857142857142857,0.5357142857142857
Tania Khatun,This movies side effects so nostalgia,Neutral,0.0,0.0
MarvelVerse,Greatest movie all time really miss 2019 Im bout go rewatch that Ive seen trailer again,Positive,0.6,0.6
NoNameN0Fame,Whatever takes,Neutral,0.0,0.0
Niji,Please understand mean harm comment dont mean offend anyone Maybe am crazy way everyone dissolved movie really reminded a lot what happened WW2 The atrocities happened are unimaginable absolutely breaks heart some scenes remind times Endgame one the beautiful heartbreaking movies ever made quite honestly think the future may qualify a documentary love all of you humans Please pray the souls have yet seen this masterpiece PS I know this from DC I wanted end this comment a positive message We all Superman save the world only tried Just remember With great power comes great responsibility,Positive,0.21087662337662336,0.6461038961038961
Colorful World,miss,Negative,0.0,0.0
Sangita Patel,Some people wont watch trailers watching moviebut us NOT US,Neutral,0.0,0.0
Hellstar Boy Gaming,The hype no way home still nothing compare end game,Negative,-0.4,0.4
Lily Harris,Thanks Marvel making weird depressing,Positive,-0.3,0.7000000000000001
captain,The thumbnail,Neutral,0.0,0.0
MightyManotaur22,This movie go as biggest pop culture event our lifetime,Neutral,0.0,0.0
Micheal Myers,This peak MCU,Neutral,0.0,0.0
Baby,This movie better at least 5 hours long,Positive,0.05000000000000001,0.43333333333333335
Callum Rangan,Unpopular opinion NWH more a hype this movie Still hype Endgame unreal,Neutral,0.5,0.5
Blake Cattle,Why the trailer cooler the actual movie,Neutral,0.0,0.1
No Name,2022 anyone still rewatch trailer,Neutral,0.0,0.0
Erica,God wish memory this movie could vanish eventually i watch again the greatest hype all time,Positive,1.0,1.0
cyerille,will forever hate for so stupid lazy years ago i didnt get experience hype all mcu movies released now just finished endgame yeah one the best movies ive ever watched all the other mcu films,Negative,-0.195,0.715
Pixer4k,even theres small chance shows antman,Positive,-0.25,0.4
The Unbiased Guy.,Tony Natasha Steve say Whatever takes Thor says has seen all people die Because already took everything Nothing left be taken away him,Negative,0.0,0.0
Adrian D'cruz,present you The highest grossing movie all time,Negative,0.0,0.0
AlChampz,It means something else The world changed none us go back 2019 This the fight our lives we going win Whatever takes,Positive,0.4,0.2
Steel ✰ Blue • Eyes,honestly so much regret being Marvel fan IW Endgame came Everyone so excited hyped wouldve LOVED see in theaters a full crowd Watching at home feel like doesnt experience love fandom all the cast crew creators I will forever apart Marvel 3,Positive,0.425,0.58
Techify Tech,This endgame ended of main characters,Neutral,0.16666666666666666,0.3333333333333333
Sintro,Cant wait show kids while wife I reminisce it came as were kids,Neutral,0.0,0.0
Sam Mejah,End game a legendary movie But thing they didnt get right Hulks character He have meaner bigger powerful like hulk The Incredible Hulk played Norton,Positive,0.34761904761904766,0.7226190476190476
Vince Vergel de Dios,Whos after 6 months Some people move but us,Neutral,0.0,0.0
Saransh Gautam,2 years passed movie released even today tony stark says whatever takes gives goosebumps,Neutral,-0.2,0.6
David Lewellen,still get goosebumps Watching and remembering felt like The yearlong wait buildup emotional attachment internal understanding when said whatever takes meant it Cheering heroes screen like are REAL,Positive,0.06666666666666667,0.3166666666666667
DEMAK EVO Z X LC135,THANOS WAS RIGHT,Neutral,0.2857142857142857,0.5357142857142857
Mahue Wi,This truly end an era Like a way end OGs begin new stories the MCU,Positive,0.13636363636363635,0.45454545454545453
Darth Godzilla,Fantastic movie,Positive,0.4,0.9
someone known,Avatar Highest grossing film Endgame Hold beer Thor Ummm drank,Negative,0.0,0.0
Avishek Sarkar,Its amazing how people still watch trailer this day feel amazed nostalgic Itll with us years,Positive,0.050000000000000044,0.95
Scorpido,Despite movie already out 2 years trailer still gives chills,Neutral,0.0,0.0
colt brawl stars,Look amezing,Neutral,0.0,0.0
Saul Moisés Cortes Guzmán,La mejor pelcula de la historia de Marvel sin duda alguna,Negative,0.0,0.0
Raniel Velasco,Tf just noticed Chris Hemsworths giggles end didnt even seen in the film,Positive,0.0,0.0
_A_ Celestial,came Nostalgic Its 2 months 2k19 get This pre Endgame era thing happy positive happened year The hype the way every single one all pumped scared excited sad enthusiastic The craze crazy,Positive,0.04135551948051949,0.7887175324675326
Caped Baldy,still find hilarious Tony didnt even giving War Machine nanotech upgrade,Positive,0.5,1.0
Kiłł Sś,The re release comes next week Were the endgame,Neutral,0.0,0.0
bob boob,ging ca c Phc nghe m v nh nhng nhng vn y trm ni lc Like version,Positive,0.0,0.0
Angel Aisha,There no move can match movie RIP Tony all miss,Negative,0.0,0.0
DJ EMMET EDM,Nice movie marvel,Positive,0.6,1.0
Tomas Romero,Being responsible 50 life the universe all because selfish revenge drive brings feel guilty To whole new meaning Dont worry Thor your not alone,Negative,-0.09272727272727274,0.6809090909090909
akhil elvin,Some people say nwhbatman better endgame not us,Positive,0.5,0.5
Feeling Purple,Stylist What hair style you want Black Widow Black Widow YES,Positive,-0.16666666666666666,0.43333333333333335
Pakistanmare Pakistanmare,cringe much Tony is best,Positive,0.6,0.25
Gabriel Burgess,Whatever takes vow people Ukraine help end war save lives used see film masterpiece now see as and a rallying cry for us today fight Putin Slava Ukraine,Positive,0.0,0.0
Marvel Universe,Marvel All Ways Best,Positive,1.0,0.3
☯︎ ಕನ್ನಡಿಗ☢︎︎,KGF chapter 2 Berk rthe records Avengers end game,Neutral,-0.4,0.4
J,mean least on disney plus,Neutral,-0.30625,0.54375
Shiona Curry,Producer Alright depressing you want Avengers Yes Edit Wait minute never got than 4 likes a comment thanks kids,Positive,-0.19999999999999998,0.55
Jonathan Huertas,never a fan marvel I cant deny this trailer the courage the US citizens gives hope our countrys future,Positive,0.0,0.125
Joe King,knew Clint would train Kate Bishop not daughter I saw shoot bow,Negative,0.0,0.0
Said Escalante,am ironman,Neutral,0.0,0.0
Vipul Bhargava,This feels different what Covid done,Neutral,0.0,0.6
Gaminwithpro Player,The red symbolize death tony Stark,Negative,-0.1,0.3
Adam Afandi,will take pee this movie Whatever takes,Neutral,0.0,0.0
M Pranav,Marvel movies characters something special even though not real story actingetc everything makes us feel real gives goosebumps every time watch itthought years r passing will in hearts forever,Positive,0.15238095238095237,0.3904761904761905
Nicc,Hairstylist Here some hairstyle options Black Widow want of,Positive,-0.16666666666666666,0.43333333333333335
JayWsp,The world changed really hit hard 2008 seemed like year ago Life fire this movie trailer came,Negative,-0.04583333333333334,0.37083333333333335
Cooper Slays,wish could go back opening day this movie experience for the first time,Positive,0.125,0.16666666666666666
die345,Epico,Neutral,0.0,0.0
Ishan Pandey,Hats too MARVEL making type thing is attached our hearts Luv U 3000,Positive,0.0,0.0
Iam Human,Its February 2022 still are watching,Neutral,0.0,0.0
ChiknNRice,dr strange 14000605 outcomes win 1 of them black widow shoots bullets dr strange this joke you,Positive,0.13333333333333333,0.2833333333333333
Shane Ocampo,really missed movie That time this movie exclusive theaters were going cinema watch the premiere the first day That time my body goosebumps Man good old days have a lot stories tell my grandchildren soon cause wont experience we experience this movie,Positive,0.3125,0.3333333333333333
Byren Huang,Seeing Steve Rogers that flashback still gives the feels He went the guy gets bullied the guy makes sure others dont get bullied,Positive,0.5,0.8888888888888888
Joseph G,Its time,Neutral,0.0,0.0
TPR Shadow,Probably greatest movie all time doubt The hype execution story surprises crying moments happy moments No one forget Iron man death scene,Negative,0.5333333333333333,0.8666666666666667
Arthur Faria,Epic,Neutral,0.1,0.4
Sad Trombone,The Avengers win Whatever takes,Positive,0.8,0.4
Aathil Ameen,Never I ever like goosebumps even was released two years ago best lifetime movie words,Positive,1.0,0.3
Monkey D. Luffy,Its 3 years I still feel hype,Neutral,0.0,0.0
Flexy,epic TT,Neutral,0.1,0.4
Profound,Even though Ive watched trailer the movie many times still gives goosebumps,Neutral,0.5,0.5
die345,Me gustaa,Neutral,0.0,0.0
Tyrell King,Captain America whatever takes Black widow whatever takes Ronin whatever takes Iron man whatever takes,Neutral,-0.16666666666666666,0.43333333333333335
OM 9.8D Clash,remember was hyped this movie,Neutral,0.0,0.0
Sad And lonely,Stan Lee thank so much giving us childhoods present future Heroes believe Rest In Peace are our true hero,Positive,0.1375,0.24375000000000002
Thomson,Still gives goosebumps till day,Neutral,0.0,0.0
GurjotKaler-_-,The hype this movie infinity war never the ever My two favourite movies well wasnt overhyped like movies lived to,Negative,0.0,0.0
die345,Me gustaa,Neutral,0.0,0.0
Kevin,dont know every time see trailer get goosebumps,Neutral,0.0,0.0
FAdead XO,Miss time,Negative,0.0,0.0
Skiiman,Endgame looks like even ambitious crossover Infinity war I dont know its possible literally half universe,Positive,0.02777777777777778,0.638888888888889
Hol M,literally watched movie everyday summer Best movie ever,Positive,0.4,0.44999999999999996
Siva Joseph,No one forget movie Epic,Negative,0.1,0.4
Deleted Devil Deleted Angel,Man hated watching movie first time legit sick vomited first minutes the movie even the male bathroom at the end the hall didnt make Man sure glad I rewatched the 2nd time figure what happened great times,Negative,0.0761904761904762,0.551410934744268
RE$PECT,After 2 years still gives goosebumps,Neutral,0.0,0.0
JRM,Man was grade 9 this movie came now am 12 this trailer literally came when was school,Neutral,0.0,0.0
Captain Memez,Thanos No one kill black widows pew pew gun hold beer,Neutral,-0.16666666666666666,0.43333333333333335
Grippie,Watched movie many times But trailer still gives chills,Neutral,0.5,0.5
Ankit Ghosh/das,Cant believe its already 2 years since masterpiece born,Positive,0.0,0.0
"varuthapadatha tg, lol sangam",Still comments section active,Positive,-0.13333333333333333,0.6
Natistics V2,This probably best trailer a movie all time,Positive,1.0,0.3
The Ox,dont think will another movie like endgame infinity war,Negative,0.0,0.0
Vishal Reddy,Imagine most hyped movie all time LIVING UP TO THE HYPE,Neutral,0.5,0.5
Joe Showell,still get goosebumps the full theatre screaming shouting a movie,Negative,0.35,0.55
Cyber Guy,Now does put smile my face,Positive,0.3,0.1
Sleepingnowpls Productions,Im excited this movie come,Positive,0.375,0.75
Gumer Zambrano,Whenever rewatch trailer feel immense anticipation felt leading to Endgame,Positive,0.0,1.0
die345,Me gustaaa,Neutral,0.0,0.0
Dante,think lot people missed underlying theme will how shifted Infinity War Endgame If Loki allowed Thor die Thanos wouldnt gotten space stone,Negative,0.0,0.0
NISH,Can believe was 2 years ago,Neutral,0.0,0.0
Muhammad White,will go see movie second comes,Neutral,0.0,0.0
D_Gamer,still remember i hype this movie,Neutral,0.0,0.0
Jack Studio 🇺🇦,Even today still get chills watching,Neutral,0.0,0.0
Venkat Narayan,Lets Start Over,Neutral,0.0,0.0
Avery Hosler,loved theme song way did in endgame,Positive,0.7,0.8
AdzzieMac Edits,couldnt gotten better farewell movie we tried,Negative,0.5,0.5
Pool_Dead,Thanos failed make balance now corona trying make balance,Negative,-0.5,0.3
potato,still get goosebumbs watching trailer,Neutral,0.0,0.0
Shreya Verma,Omg got Goosebumps time I hear the main sound,Neutral,0.2833333333333333,0.3666666666666667
Nono Ami,Bring back the cinema all deleted scenes,Neutral,0.0,0.0
NASIF ZAWAD,148 thisit gives goosebumps every time Really miss days,Negative,0.2,0.2
Lucas nesey,3,Neutral,0.0,0.0
Antonella,When realize this be last time will see six originals together,Neutral,0.0,0.06666666666666667
Swiftieforever13💜👑,That theme Oh just Fabulous dare those companies movie theme even beat classic masterpiece,Positive,0.2833333333333333,0.5833333333333334
Pu1se is cool,Hawkeye shoots arrows Thanos Am a joke you,Positive,0.0,0.0
shiny sony,Biggest regret my life that didnt watch masterpiece theatre,Negative,0.0,0.0
Arav Bhai,Its just movie emotions Love 3000,Positive,0.5,0.6
Raziq Syah,Miss,Negative,0.0,0.0
Michael Suezo,Rewatching trailer still gives goosebumps,Neutral,0.0,0.0
Murot Lovery,Love,Positive,0.5,0.6
Ri Ri,158 Marvel sound track always gives goosebumps every single movie,Positive,0.1642857142857143,0.30714285714285716
madison connolly,2 years later i still get chills watching thus,Neutral,0.0,0.0
Marvelous,004 thats i feel the movie will never experience type energy ever,Negative,0.0,0.0
trailar of films,Superb,Positive,1.0,1.0
Cubick,remember seeing trailer uploaded hype real wish could go back 2019,Positive,0.1,0.15000000000000002
Aayati Desai,Not rewatching every marvel movie trailer,Negative,0.0,0.0
Knightmare,We watch on first show Whatever takes Whatever takes,Neutral,0.25,0.3333333333333333
SerelTheGreat,2 years ago still give goosebumps even already watch hundred times,Neutral,0.0,0.0
88 rakesh Naik,Hype real time,Neutral,0.2,0.30000000000000004
die345,Epicaa,Neutral,0.0,0.0
Anshit Tripathi,Still trailer gives goosebumps,Neutral,0.0,0.0
Mina Naguib,Take back,Neutral,0.0,0.0
Dawson Hobbs,Whatever takes Alright whos dying,Positive,0.0,0.0
prince,It a lifetime experience saw movie big screenIll never forget moment feelingIf alive I would tell kids 2030 year that we people have experience something incredible 2019,Positive,0.3333333333333333,0.4666666666666666
Henry Chang,When youre going see Avengers Endgame Friend You saw movie days ago didnt Me It seems like thousand years ago,Positive,0.0,0.0
Kaif Mirza,We still remember movie WHATEVER IT TAKES,Neutral,0.0,0.0
Mannagoo,The goose bumps man It still hits hard,Negative,-0.2916666666666667,0.5416666666666666
MOVIE INFO,,Neutral,0.0,0.0
Anime_editzz,After watching trailer 100 times gives goosebumps,Neutral,0.0,0.0
LORGAN,Bring back iron man character,Neutral,0.0,0.0
Djaider Abdou,protec attac most improtantly need infinity stones bac,Neutral,0.5,0.5
gary matus romero,Dos aos y no lo supero,Negative,0.0,0.0
"Sharma Saheb,PSO Wing-ll",In theatre all Avengers Assemble A loud voice came form crowd Wakanda forever But one little voice said We whatever takes golden words Steve true meanings,Positive,0.140625,0.6125
johnny cesareo,nan,Neutral,0.0,0.0
`mackenzie♥︎,We watched movie this afternoon yes still get excited every scenes miss thats im re watching all the start,Positive,0.375,0.75
die345,Epicaa,Neutral,0.0,0.0
Youssef Tamerr,Friend dont ever get bored watching old trailers Me can this day,Positive,-0.2,0.6
Srivani P,It still gives goosebumps,Neutral,0.0,0.0
Azhureus,Even tho watched films like 100 times Im still coming back this The hype back was real,Positive,0.06666666666666667,0.10000000000000002
Raj Vardhan,How everyone outer space know English M C U,Neutral,0.0,0.0
Naman Shrivastava,The trailer still giving goosebumps,Positive,0.0,0.0
Naga Sari,2019 Avanger endgameok more AvangerAfter 5 yearsat 2023 cinema Avanger united ironman revival,Positive,0.5,0.5
Evil Slayer,am jealous DR STRANGE cuz has already seen movie,Negative,-0.05,0.15
Mirayah,Ready risk anything watch movie like my first time,Positive,0.225,0.41666666666666663
P×3,They finally showed iron Man avengers back againSuch relief 157,Positive,0.0,0.5
The Man With the Annoyed Face,first got MCU Infinity War a month away My friends wanted see ended binging the MCU movies shows By the time Infinity war came beyond hooked Im truly glad I got this and got to see Endgame opening night You cant beat feeling seeing and clapping with like minded people,Positive,0.375,0.6666666666666666
aryan assad,still get chills watching 2 years later,Neutral,0.0,0.0
NathanKO,Avengers 5 real endgame Avengers 6 realest endgame Avengers 1000 Real real endgame,Neutral,0.25,0.37500000000000006
The Only Thijs,Now hype this gone Ive thought maybe wouldnt another chance feel excitement waiting this movie with No Way Home coming Im starting feel the hype build but lets hope it doesnt get delayed due Covid,Positive,-0.0625,0.2375
SANJAY.S,Is Im only person Watching trailer 2022,Neutral,0.0,1.0
